url,original_data,cleaned_data
https://www.newtimes.co.rw/article/26454/sports/rwandan-officials-visit-hungarian-f1-grand-prix-circuit,"Rwandan officials visit Hungarian F1 Grand Prix circuit - The New Times Do you have an idea for The New Times to cover? Submit it here! Sunday, June 08, 2025 Subscribe Now News Rwanda Business Africa International Technology Agriculture Coronavirus Politics Environment Energy Infrastructure Health Crime Finance Law Housing Aviation Tourism Featured Culture Economy Education Security Women Science Religion Kwibuka Opinions Feedback from readers Editorial Sports Volleyball Cycling Football Basketball Other sports Karate Handball Cricket Swimming Tennis AFCON 2023 Entertainment Music Cinema Art Fashion Others Showbiz Videos Jobs & Tenders Epaper Events Subscribe Now Sports Rwandan officials visit Hungarian F1 Grand Prix circuit Rwandan Minister of Foreign Affairs and International Cooperation, Olivier Nduhungirehe and Minister of Sports Nelly Mukazayire  visit to Hungaroring, the home of the Hungarian Formula One on Wednesday, May 14 Peter Kamasa Thursday, May 15, 2025 Share Do you have an idea for The New Times to cover? Submit it here! About Us Our Company Policy Terms And Conditions History Feed Subscribe Newsletter Print Jobs Advertise Online Print Jobs Tenders Classifieds Contact Us Opinions Letters to the Editors News Opinion Sports Lifestyle Video Jobs & Tenders Epaper Podcast © Copyright The New Times Rwanda 2007 - 2022",rwandan officials visit hungarian f1 grand prix circuit the new times do you have an idea for the new times to cover submit it here sunday june 08 2025 subscribe now news rwanda business africa international technology agriculture coronavirus politics environment energy infrastructure health crime finance law housing aviation tourism featured culture economy education security women science religion kwibuka opinions feedback from readers editorial sports volleyball cycling football basketball other sports karate handball cricket swimming tennis afcon 2023 entertainment music cinema art fashion others showbiz videos jobs tenders epaper events subscribe now sports rwandan officials visit hungarian f1 grand prix circuit rwandan minister of foreign affairs and international cooperation olivier nduhungirehe and minister of sports nelly mukazayire visit to hungaroring the home of the hungarian formula one on wednesday may 14 peter kamasa thursday may 15 2025 share do you have an idea for the new times to cover submit it here about us our company policy terms and conditions history feed subscribe newsletter print jobs advertise online print jobs tenders classifieds contact us opinions letters to the editors news opinion sports lifestyle video jobs tenders epaper podcast copyright the new times rwanda 2007 2022
https://www.newtimes.co.rw/article/26523/sports/tennis/tennis-rwandas-umulisa-nominated-for-sports-emmy-awards,"Tennis: Rwanda’s Umulisa nominated for Sports Emmy Awards - The New Times Do you have an idea for The New Times to cover? Submit it here! Sunday, June 08, 2025 Subscribe Now News Rwanda Business Africa International Technology Agriculture Coronavirus Politics Environment Energy Infrastructure Health Crime Finance Law Housing Aviation Tourism Featured Culture Economy Education Security Women Science Religion Kwibuka Opinions Feedback from readers Editorial Sports Volleyball Cycling Football Basketball Other sports Karate Handball Cricket Swimming Tennis AFCON 2023 Entertainment Music Cinema Art Fashion Others Showbiz Videos Jobs & Tenders Epaper Events Subscribe Now Sports Tennis: Rwanda’s Umulisa nominated for Sports Emmy Awards Former Rwandan tennis number one Joseline Umulisa is among  nominees vying for prizes at the 46th Sports Emmy Awards in the United States-courtesy Dylan Mugenga Sunday, May 18, 2025 Share Do you have an idea for The New Times to cover? Submit it here! About Us Our Company Policy Terms And Conditions History Feed Subscribe Newsletter Print Jobs Advertise Online Print Jobs Tenders Classifieds Contact Us Opinions Letters to the Editors News Opinion Sports Lifestyle Video Jobs & Tenders Epaper Podcast © Copyright The New Times Rwanda 2007 - 2022",tennis rwandas umulisa nominated for sports emmy awards the new times do you have an idea for the new times to cover submit it here sunday june 08 2025 subscribe now news rwanda business africa international technology agriculture coronavirus politics environment energy infrastructure health crime finance law housing aviation tourism featured culture economy education security women science religion kwibuka opinions feedback from readers editorial sports volleyball cycling football basketball other sports karate handball cricket swimming tennis afcon 2023 entertainment music cinema art fashion others showbiz videos jobs tenders epaper events subscribe now sports tennis rwandas umulisa nominated for sports emmy awards former rwandan tennis number one joseline umulisa is among nominees vying for prizes at the 46th sports emmy awards in the united statescourtesy dylan mugenga sunday may 18 2025 share do you have an idea for the new times to cover submit it here about us our company policy terms and conditions history feed subscribe newsletter print jobs advertise online print jobs tenders classifieds contact us opinions letters to the editors news opinion sports lifestyle video jobs tenders epaper podcast copyright the new times rwanda 2007 2022
https://www.newtimes.co.rw/article/26792/sports/basketball/how-rwandan-man-is-building-top-basketball-courts-all-over-africa,"How Rwandan man is building top basketball courts all over Africa - The New Times Do you have an idea for The New Times to cover? Submit it here! Sunday, June 08, 2025 Subscribe Now News Rwanda Business Africa International Technology Agriculture Coronavirus Politics Environment Energy Infrastructure Health Crime Finance Law Housing Aviation Tourism Featured Culture Economy Education Security Women Science Religion Kwibuka Opinions Feedback from readers Editorial Sports Volleyball Cycling Football Basketball Other sports Karate Handball Cricket Swimming Tennis AFCON 2023 Entertainment Music Cinema Art Fashion Others Showbiz Videos Jobs & Tenders Epaper Events Subscribe Now Sports How Rwandan man is building top basketball courts all over Africa Karake at a construction site. His company Kefa Sports has built about 50 rubber courts in Rwanda. Courtesy. Hudson Kuteesa Thursday, May 29, 2025 Share Do you have an idea for The New Times to cover? Submit it here! About Us Our Company Policy Terms And Conditions History Feed Subscribe Newsletter Print Jobs Advertise Online Print Jobs Tenders Classifieds Contact Us Opinions Letters to the Editors News Opinion Sports Lifestyle Video Jobs & Tenders Epaper Podcast © Copyright The New Times Rwanda 2007 - 2022",how rwandan man is building top basketball courts all over africa the new times do you have an idea for the new times to cover submit it here sunday june 08 2025 subscribe now news rwanda business africa international technology agriculture coronavirus politics environment energy infrastructure health crime finance law housing aviation tourism featured culture economy education security women science religion kwibuka opinions feedback from readers editorial sports volleyball cycling football basketball other sports karate handball cricket swimming tennis afcon 2023 entertainment music cinema art fashion others showbiz videos jobs tenders epaper events subscribe now sports how rwandan man is building top basketball courts all over africa karake at construction site his company kefa sports has built about 50 rubber courts in rwanda courtesy hudson kuteesa thursday may 29 2025 share do you have an idea for the new times to cover submit it here about us our company policy terms and conditions history feed subscribe newsletter print jobs advertise online print jobs tenders classifieds contact us opinions letters to the editors news opinion sports lifestyle video jobs tenders epaper podcast copyright the new times rwanda 2007 2022
https://www.newtimes.co.rw/article/26885/sports/football/you-did-partners-proudkagame-congratulates-psg-on-ucl-triumph,"You did partners proud—​​​​​​​Kagame congratulates PSG on UCL triumph - The New Times Do you have an idea for The New Times to cover? Submit it here! Sunday, June 08, 2025 Subscribe Now News Rwanda Business Africa International Technology Agriculture Coronavirus Politics Environment Energy Infrastructure Health Crime Finance Law Housing Aviation Tourism Featured Culture Economy Education Security Women Science Religion Kwibuka Opinions Feedback from readers Editorial Sports Volleyball Cycling Football Basketball Other sports Karate Handball Cricket Swimming Tennis AFCON 2023 Entertainment Music Cinema Art Fashion Others Showbiz Videos Jobs & Tenders Epaper Events Subscribe Now Sports You did partners proud—​​​​​​​Kagame congratulates PSG on UCL triumph President Paul Kagame congratulated Visit Rwanda partners Paris Saint-Germain on their first ever UEFA Champions League triumph-courtesy Edmund Okai Gyimah Sunday, June 01, 2025 Share Do you have an idea for The New Times to cover? Submit it here! About Us Our Company Policy Terms And Conditions History Feed Subscribe Newsletter Print Jobs Advertise Online Print Jobs Tenders Classifieds Contact Us Opinions Letters to the Editors News Opinion Sports Lifestyle Video Jobs & Tenders Epaper Podcast © Copyright The New Times Rwanda 2007 - 2022",you did partners proudkagame congratulates psg on ucl triumph the new times do you have an idea for the new times to cover submit it here sunday june 08 2025 subscribe now news rwanda business africa international technology agriculture coronavirus politics environment energy infrastructure health crime finance law housing aviation tourism featured culture economy education security women science religion kwibuka opinions feedback from readers editorial sports volleyball cycling football basketball other sports karate handball cricket swimming tennis afcon 2023 entertainment music cinema art fashion others showbiz videos jobs tenders epaper events subscribe now sports you did partners proudkagame congratulates psg on ucl triumph president paul kagame congratulated visit rwanda partners paris saintgermain on their first ever uefa champions league triumphcourtesy edmund okai gyimah sunday june 01 2025 share do you have an idea for the new times to cover submit it here about us our company policy terms and conditions history feed subscribe newsletter print jobs advertise online print jobs tenders classifieds contact us opinions letters to the editors news opinion sports lifestyle video jobs tenders epaper podcast copyright the new times rwanda 2007 2022
https://www.newtimes.co.rw/article/26586/sports/basketball/bal-set-standards-and-were-working-hard-to-beat-them-minister-ngarambe,"BAL set standards and we’re working hard to beat them--Minister Ngarambe - The New Times Do you have an idea for The New Times to cover? Submit it here! Sunday, June 08, 2025 Subscribe Now News Rwanda Business Africa International Technology Agriculture Coronavirus Politics Environment Energy Infrastructure Health Crime Finance Law Housing Aviation Tourism Featured Culture Economy Education Security Women Science Religion Kwibuka Opinions Feedback from readers Editorial Sports Volleyball Cycling Football Basketball Other sports Karate Handball Cricket Swimming Tennis AFCON 2023 Entertainment Music Cinema Art Fashion Others Showbiz Videos Jobs & Tenders Epaper Events Subscribe Now Sports BAL set standards and we’re working hard to beat them--Minister Ngarambe Rwanda's Minister of State for Sports Rwego Ngarambe has hailed BAL for helping Rwanda to elevate the basketball standards in all aspects-Photo by Dan Gatsinzi Jessica Agasaro Tuesday, May 20, 2025 Share Do you have an idea for The New Times to cover? Submit it here! About Us Our Company Policy Terms And Conditions History Feed Subscribe Newsletter Print Jobs Advertise Online Print Jobs Tenders Classifieds Contact Us Opinions Letters to the Editors News Opinion Sports Lifestyle Video Jobs & Tenders Epaper Podcast © Copyright The New Times Rwanda 2007 - 2022",bal set standards and were working hard to beat themminister ngarambe the new times do you have an idea for the new times to cover submit it here sunday june 08 2025 subscribe now news rwanda business africa international technology agriculture coronavirus politics environment energy infrastructure health crime finance law housing aviation tourism featured culture economy education security women science religion kwibuka opinions feedback from readers editorial sports volleyball cycling football basketball other sports karate handball cricket swimming tennis afcon 2023 entertainment music cinema art fashion others showbiz videos jobs tenders epaper events subscribe now sports bal set standards and were working hard to beat themminister ngarambe rwandas minister of state for sports rwego ngarambe has hailed bal for helping rwanda to elevate the basketball standards in all aspectsphoto by dan gatsinzi jessica agasaro tuesday may 20 2025 share do you have an idea for the new times to cover submit it here about us our company policy terms and conditions history feed subscribe newsletter print jobs advertise online print jobs tenders classifieds contact us opinions letters to the editors news opinion sports lifestyle video jobs tenders epaper podcast copyright the new times rwanda 2007 2022
https://www.newtimes.co.rw/article/26442/sports/football/rwanda-see-off-zimbabwe-in-u20-womens-world-cup-qualifiers,"Rwanda see off Zimbabwe in U20 Women’s World Cup qualifiers - The New Times Do you have an idea for The New Times to cover? Submit it here! Sunday, June 08, 2025 Subscribe Now News Rwanda Business Africa International Technology Agriculture Coronavirus Politics Environment Energy Infrastructure Health Crime Finance Law Housing Aviation Tourism Featured Culture Economy Education Security Women Science Religion Kwibuka Opinions Feedback from readers Editorial Sports Volleyball Cycling Football Basketball Other sports Karate Handball Cricket Swimming Tennis AFCON 2023 Entertainment Music Cinema Art Fashion Others Showbiz Videos Jobs & Tenders Epaper Events Subscribe Now Sports Rwanda see off Zimbabwe in U20 Women’s World Cup qualifiers Rwanda eliminated Zimbabwe on Wednesday at Kigali Pele Stadium to set date with Nigeria in the second round of the FIFA Women's U20 World Cup 2026 qualifiers-courtesy Peter Kamasa Wednesday, May 14, 2025 Share Do you have an idea for The New Times to cover? Submit it here! About Us Our Company Policy Terms And Conditions History Feed Subscribe Newsletter Print Jobs Advertise Online Print Jobs Tenders Classifieds Contact Us Opinions Letters to the Editors News Opinion Sports Lifestyle Video Jobs & Tenders Epaper Podcast © Copyright The New Times Rwanda 2007 - 2022",rwanda see off zimbabwe in u20 womens world cup qualifiers the new times do you have an idea for the new times to cover submit it here sunday june 08 2025 subscribe now news rwanda business africa international technology agriculture coronavirus politics environment energy infrastructure health crime finance law housing aviation tourism featured culture economy education security women science religion kwibuka opinions feedback from readers editorial sports volleyball cycling football basketball other sports karate handball cricket swimming tennis afcon 2023 entertainment music cinema art fashion others showbiz videos jobs tenders epaper events subscribe now sports rwanda see off zimbabwe in u20 womens world cup qualifiers rwanda eliminated zimbabwe on wednesday at kigali pele stadium to set date with nigeria in the second round of the fifa womens u20 world cup 2026 qualifierscourtesy peter kamasa wednesday may 14 2025 share do you have an idea for the new times to cover submit it here about us our company policy terms and conditions history feed subscribe newsletter print jobs advertise online print jobs tenders classifieds contact us opinions letters to the editors news opinion sports lifestyle video jobs tenders epaper podcast copyright the new times rwanda 2007 2022
https://www.newtimes.co.rw/article/27038/sports/basketball/bal-2025-al-ahli-tripoli-subjected-to-first-loss-of-the-season,"BAL 2025: Al Ahli Tripoli subjected to first loss of the season - The New Times Do you have an idea for The New Times to cover? Submit it here! Sunday, June 08, 2025 Subscribe Now News Rwanda Business Africa International Technology Agriculture Coronavirus Politics Environment Energy Infrastructure Health Crime Finance Law Housing Aviation Tourism Featured Culture Economy Education Security Women Science Religion Kwibuka Opinions Feedback from readers Editorial Sports Volleyball Cycling Football Basketball Other sports Karate Handball Cricket Swimming Tennis AFCON 2023 Entertainment Music Cinema Art Fashion Others Showbiz Videos Jobs & Tenders Epaper Events Subscribe Now Sports BAL 2025: Al Ahli Tripoli subjected to first loss of the season An Al Ittihad player (in green) dribbles past his Al Ahli counterpart during the game. Courtesy Damas Sikubwabo Saturday, June 07, 2025 Share Do you have an idea for The New Times to cover? Submit it here! About Us Our Company Policy Terms And Conditions History Feed Subscribe Newsletter Print Jobs Advertise Online Print Jobs Tenders Classifieds Contact Us Opinions Letters to the Editors News Opinion Sports Lifestyle Video Jobs & Tenders Epaper Podcast © Copyright The New Times Rwanda 2007 - 2022",bal 2025 al ahli tripoli subjected to first loss of the season the new times do you have an idea for the new times to cover submit it here sunday june 08 2025 subscribe now news rwanda business africa international technology agriculture coronavirus politics environment energy infrastructure health crime finance law housing aviation tourism featured culture economy education security women science religion kwibuka opinions feedback from readers editorial sports volleyball cycling football basketball other sports karate handball cricket swimming tennis afcon 2023 entertainment music cinema art fashion others showbiz videos jobs tenders epaper events subscribe now sports bal 2025 al ahli tripoli subjected to first loss of the season an al ittihad player in green dribbles past his al ahli counterpart during the game courtesy damas sikubwabo saturday june 07 2025 share do you have an idea for the new times to cover submit it here about us our company policy terms and conditions history feed subscribe newsletter print jobs advertise online print jobs tenders classifieds contact us opinions letters to the editors news opinion sports lifestyle video jobs tenders epaper podcast copyright the new times rwanda 2007 2022
https://www.newtimes.co.rw/article/27038/sports/basketball/bal-2025-al-ahli-tripoli-subjected-to-first-loss-of-the-season,"BAL 2025: Al Ahli Tripoli subjected to first loss of the season - The New Times Do you have an idea for The New Times to cover? Submit it here! Sunday, June 08, 2025 Subscribe Now News Rwanda Business Africa International Technology Agriculture Coronavirus Politics Environment Energy Infrastructure Health Crime Finance Law Housing Aviation Tourism Featured Culture Economy Education Security Women Science Religion Kwibuka Opinions Feedback from readers Editorial Sports Volleyball Cycling Football Basketball Other sports Karate Handball Cricket Swimming Tennis AFCON 2023 Entertainment Music Cinema Art Fashion Others Showbiz Videos Jobs & Tenders Epaper Events Subscribe Now Sports BAL 2025: Al Ahli Tripoli subjected to first loss of the season An Al Ittihad player (in green) dribbles past his Al Ahli counterpart during the game. Courtesy Damas Sikubwabo Saturday, June 07, 2025 Share Do you have an idea for The New Times to cover? Submit it here! About Us Our Company Policy Terms And Conditions History Feed Subscribe Newsletter Print Jobs Advertise Online Print Jobs Tenders Classifieds Contact Us Opinions Letters to the Editors News Opinion Sports Lifestyle Video Jobs & Tenders Epaper Podcast © Copyright The New Times Rwanda 2007 - 2022",bal 2025 al ahli tripoli subjected to first loss of the season the new times do you have an idea for the new times to cover submit it here sunday june 08 2025 subscribe now news rwanda business africa international technology agriculture coronavirus politics environment energy infrastructure health crime finance law housing aviation tourism featured culture economy education security women science religion kwibuka opinions feedback from readers editorial sports volleyball cycling football basketball other sports karate handball cricket swimming tennis afcon 2023 entertainment music cinema art fashion others showbiz videos jobs tenders epaper events subscribe now sports bal 2025 al ahli tripoli subjected to first loss of the season an al ittihad player in green dribbles past his al ahli counterpart during the game courtesy damas sikubwabo saturday june 07 2025 share do you have an idea for the new times to cover submit it here about us our company policy terms and conditions history feed subscribe newsletter print jobs advertise online print jobs tenders classifieds contact us opinions letters to the editors news opinion sports lifestyle video jobs tenders epaper podcast copyright the new times rwanda 2007 2022
https://www.newtimes.co.rw/article/27033/sports/football/republican-guard-div-four-share-spoils-in-liberation-cup-showdown,"Republican Guard, Div Four share spoils in Liberation Cup showdown - The New Times Do you have an idea for The New Times to cover? Submit it here! Sunday, June 08, 2025 Subscribe Now News Rwanda Business Africa International Technology Agriculture Coronavirus Politics Environment Energy Infrastructure Health Crime Finance Law Housing Aviation Tourism Featured Culture Economy Education Security Women Science Religion Kwibuka Opinions Feedback from readers Editorial Sports Volleyball Cycling Football Basketball Other sports Karate Handball Cricket Swimming Tennis AFCON 2023 Entertainment Music Cinema Art Fashion Others Showbiz Videos Jobs & Tenders Epaper Events Subscribe Now Sports Republican Guard, Div Four share spoils in Liberation Cup showdown A Div Four player (in yellow) vies for the ball with two RG players. Courtesy. Dylan Mugenga Friday, June 06, 2025 Share Do you have an idea for The New Times to cover? Submit it here! About Us Our Company Policy Terms And Conditions History Feed Subscribe Newsletter Print Jobs Advertise Online Print Jobs Tenders Classifieds Contact Us Opinions Letters to the Editors News Opinion Sports Lifestyle Video Jobs & Tenders Epaper Podcast © Copyright The New Times Rwanda 2007 - 2022",republican guard div four share spoils in liberation cup showdown the new times do you have an idea for the new times to cover submit it here sunday june 08 2025 subscribe now news rwanda business africa international technology agriculture coronavirus politics environment energy infrastructure health crime finance law housing aviation tourism featured culture economy education security women science religion kwibuka opinions feedback from readers editorial sports volleyball cycling football basketball other sports karate handball cricket swimming tennis afcon 2023 entertainment music cinema art fashion others showbiz videos jobs tenders epaper events subscribe now sports republican guard div four share spoils in liberation cup showdown div four player in yellow vies for the ball with two rg players courtesy dylan mugenga friday june 06 2025 share do you have an idea for the new times to cover submit it here about us our company policy terms and conditions history feed subscribe newsletter print jobs advertise online print jobs tenders classifieds contact us opinions letters to the editors news opinion sports lifestyle video jobs tenders epaper podcast copyright the new times rwanda 2007 2022
