url,original_data,cleaned_data
https://www.newtimes.co.rw/sports,"Sports - The New Times Sports Do you have an idea for The New Times to cover? Submit it here! Sunday, June 08, 2025 Subscribe Now News Rwanda Business Africa International Technology Agriculture Coronavirus Politics Environment Energy Infrastructure Health Crime Finance Law Housing Aviation Tourism Featured Culture Economy Education Security Women Science Religion Kwibuka Opinions Feedback from readers Editorial Sports Volleyball Cycling Football Basketball Other sports Karate Handball Cricket Swimming Tennis AFCON 2023 Entertainment Music Cinema Art Fashion Others Showbiz Videos Jobs & Tenders Epaper Events Subscribe Now Sports Cycling Football Basketball Volleyball Other Sports Karate Handball Cricket Swimming Tennis World Cup 22 AFCON 2023 Basketball BAL 2025: APR stun reigning champions Petro de Luanda APR handed Petro de Luanda a heavy defeat in the Basketball Africa League (BAL), beating the Angolan giants by 18 points in a commanding 75-57 victory on Saturday.This was only the second time Sunday, June 08, 2025 Basketball BAL 2025: APR stun reigning champions Petro de Luanda APR handed Petro de Luanda a heavy defeat in the Basketball Africa League (BAL), beating the Angolan giants by 18 points in a commanding 75-57 victory on Saturday.This was only the second time Saturday, June 07, 2025 Football Meddie Kagere “could join” Amavubi coaching staff Amavubi head coach Adel Amrouche has said that there is a possibility of adding veteran striker Meddie Kagere to his coaching team once he retires from playing.ALSO READ: Amrouche on Kagere’s Saturday, June 07, 2025 Basketball APR BBC coach talks Nuni Omot’s addition, BAL playoffs Saturday, June 7APR Vs Petro de Luanda 4pmAPR Basketball Club head coach James Maye Jr., has said that his team is healthy and in good spirits ahead of the Basketball Africa League (BAL) 2025 Saturday, June 07, 2025 Most Read today 7 days 30 days BAL 2025: APR stun reigning champions Petro de Luanda APR BBC coach talks Nuni Omot’s addition, BAL playoffs Kigali Peace Marathon: Police announces road closures ahead of race Meddie Kagere “could join” Amavubi coaching staff Golf: Rwanda’s Nsanzuwera finishes second at international tourney in Kenya BAL 2025: APR stun reigning champions Petro de Luanda Agahozo Shalom shines at Karate GMT 2025 New trades leading headlines ahead of BAL 2025 playoffs What to know about the eight teams at BAL 2025 playoffs BAL 2025: APR stun reigning champions Petro de Luanda Algeria coach Madjid names squad for Rwanda friendlies BAL 2025: APR, holders Petro de Luanda to square off in quarterfinals Rwandan officials visit Hungarian F1 Grand Prix circuit Tennis: Rwanda’s Umulisa nominated for Sports Emmy Awards How Rwandan man is building top basketball courts all over Africa You did partners proud—​​​​​​​Kagame congratulates PSG on UCL triumph BAL set standards and we’re working hard to beat them--Minister Ngarambe Rwanda see off Zimbabwe in U20 Women’s World Cup qualifiers Basketball BAL 2025: Al Ahli Tripoli subjected to first loss of the season Football Republican Guard, Div Four share spoils in Liberation Cup showdown Basketball BAL 2025 playoffs: What should we expect from seeding matches? Football Belaili, Hadjam on target as Algeria defeat Rwanda in Constantine Football Amrouche on Kagere’s recall: Football is not about age Football Rayon Sports close in on Ugandan left-back Nicholas Mwere Latest 5 m Why do Rwandan preachers have to get theology training? 19 m Filip Reyntjens and the killing of common sense 57 m TikTok’s Khaby Lame detained in Las Vegas for overstaying U.S. Visa 1 h BAL 2025: APR stun reigning champions Petro de Luanda 1 h Don't discard beetroot leaves, they're great, say nutritionists Amrouche slams Sahabo, York for rejecting Rwanda call-up Thursday, June 05, 2025 Which players are out of contract in Rwanda Premier League? Thursday, June 05, 2025 Peace Marathon: Which elite athletes are coming to Kigali? Thursday, June 05, 2025 BAL 2025: NBA coach Sam Vincent joins APR ahead of playoffs Wednesday, June 04, 2025 Mutarambirwa edges closer to first major trophy with Kenya Police Wednesday, June 04, 2025 Sande Nemali: Police MVP talks motherhood, volleyball and secret to success Wednesday, June 04, 2025 It’s a good time to assess new players, says Nshimiyimana Tuesday, June 03, 2025 New faces in Amrouche’s squad for Algeria friendlies--Who is who? Tuesday, June 03, 2025 BAL 2025: APR, holders Petro de Luanda to square off in quarterfinals Football Transfers that could happen in the June-August window Tuesday, June 03, 2025 Basketball What to know about the eight teams at BAL 2025 playoffs Football Key moments that defined 2024/25 Rwanda Premier League Football Okwi leaves AS Kigali after one season Video Sande Nemali exclusive: Police MVP talks motherhood, volleyball and secret to success Wednesday, June 04, 2025 Rwanda and Switzerland look to strengthen bilateral cooperation Wednesday, June 04, 2025 Africa needs mindset liberation more than aid - PAM chair Musoni Wednesday, June 04, 2025 Redefining women’s health: Dr. Subira on menopause and healing Wednesday, June 04, 2025 Kwizera scores winner as Mugisha’s Stade Tunisien secure CAF CC qualification Monday, June 02, 2025 Algeria coach Madjid names squad for Rwanda friendlies Monday, June 02, 2025 New trades leading headlines ahead of BAL 2025 playoffs Monday, June 02, 2025 Sebwato credits individual fortunes to hard work Sunday, June 01, 2025 Load More Do you have an idea for The New Times to cover? Submit it here! About Us Our Company Policy Terms And Conditions History Feed Subscribe Newsletter Print Jobs Advertise Online Print Jobs Tenders Classifieds Contact Us Opinions Letters to the Editors News Opinion Sports Lifestyle Video Jobs & Tenders Epaper Podcast © Copyright The New Times Rwanda 2007 - 2022",sports the new times sports do you have an idea for the new times to cover submit it here sunday june 08 2025 subscribe now news rwanda business africa international technology agriculture coronavirus politics environment energy infrastructure health crime finance law housing aviation tourism featured culture economy education security women science religion kwibuka opinions feedback from readers editorial sports volleyball cycling football basketball other sports karate handball cricket swimming tennis afcon 2023 entertainment music cinema art fashion others showbiz videos jobs tenders epaper events subscribe now sports cycling football basketball volleyball other sports karate handball cricket swimming tennis world cup 22 afcon 2023 basketball bal 2025 apr stun reigning champions petro de luanda apr handed petro de luanda heavy defeat in the basketball africa league bal beating the angolan giants by 18 points in commanding 7557 victory on saturday this was only the second time sunday june 08 2025 basketball bal 2025 apr stun reigning champions petro de luanda apr handed petro de luanda heavy defeat in the basketball africa league bal beating the angolan giants by 18 points in commanding 7557 victory on saturday this was only the second time saturday june 07 2025 football meddie kagere could join amavubi coaching staff amavubi head coach adel amrouche has said that there is possibility of adding veteran striker meddie kagere to his coaching team once he retires from playing also read amrouche on kageres saturday june 07 2025 basketball apr bbc coach talks nuni omots addition bal playoffs saturday june 7 apr vs petro de luanda 4pm apr basketball club head coach james maye jr has said that his team is healthy and in good spirits ahead of the basketball africa league bal 2025 saturday june 07 2025 most read today 7 days 30 days bal 2025 apr stun reigning champions petro de luanda apr bbc coach talks nuni omots addition bal playoffs kigali peace marathon police announces road closures ahead of race meddie kagere could join amavubi coaching staff golf rwandas nsanzuwera finishes second at international tourney in kenya bal 2025 apr stun reigning champions petro de luanda agahozo shalom shines at karate gmt 2025 new trades leading headlines ahead of bal 2025 playoffs what to know about the eight teams at bal 2025 playoffs bal 2025 apr stun reigning champions petro de luanda algeria coach madjid names squad for rwanda friendlies bal 2025 apr holders petro de luanda to square off in quarterfinals rwandan officials visit hungarian f1 grand prix circuit tennis rwandas umulisa nominated for sports emmy awards how rwandan man is building top basketball courts all over africa you did partners proudkagame congratulates psg on ucl triumph bal set standards and were working hard to beat themminister ngarambe rwanda see off zimbabwe in u20 womens world cup qualifiers basketball bal 2025 al ahli tripoli subjected to first loss of the season football republican guard div four share spoils in liberation cup showdown basketball bal 2025 playoffs what should we expect from seeding matches football belaili hadjam on target as algeria defeat rwanda in constantine football amrouche on kageres recall football is not about age football rayon sports close in on ugandan leftback nicholas mwere latest 5 why do rwandan preachers have to get theology training 19 filip reyntjens and the killing of common sense 57 tiktoks khaby lame detained in las vegas for overstaying us visa 1 bal 2025 apr stun reigning champions petro de luanda 1 dont discard beetroot leaves theyre great say nutritionists amrouche slams sahabo york for rejecting rwanda callup thursday june 05 2025 which players are out of contract in rwanda premier league thursday june 05 2025 peace marathon which elite athletes are coming to kigali thursday june 05 2025 bal 2025 nba coach sam vincent joins apr ahead of playoffs wednesday june 04 2025 mutarambirwa edges closer to first major trophy with kenya police wednesday june 04 2025 sande nemali police mvp talks motherhood volleyball and secret to success wednesday june 04 2025 its good time to assess new players says nshimiyimana tuesday june 03 2025 new faces in amrouches squad for algeria friendlieswho is who tuesday june 03 2025 bal 2025 apr holders petro de luanda to square off in quarterfinals football transfers that could happen in the juneaugust window tuesday june 03 2025 basketball what to know about the eight teams at bal 2025 playoffs football key moments that defined 202425 rwanda premier league football okwi leaves as kigali after one season video sande nemali exclusive police mvp talks motherhood volleyball and secret to success wednesday june 04 2025 rwanda and switzerland look to strengthen bilateral cooperation wednesday june 04 2025 africa needs mindset liberation more than aid pam chair musoni wednesday june 04 2025 redefining womens health dr subira on menopause and healing wednesday june 04 2025 kwizera scores winner as mugishas stade tunisien secure caf cc qualification monday june 02 2025 algeria coach madjid names squad for rwanda friendlies monday june 02 2025 new trades leading headlines ahead of bal 2025 playoffs monday june 02 2025 sebwato credits individual fortunes to hard work sunday june 01 2025 load more do you have an idea for the new times to cover submit it here about us our company policy terms and conditions history feed subscribe newsletter print jobs advertise online print jobs tenders classifieds contact us opinions letters to the editors news opinion sports lifestyle video jobs tenders epaper podcast copyright the new times rwanda 2007 2022
https://www.newtimes.co.rw/other-sports,"Other Sports - The New Times Other Sports Do you have an idea for The New Times to cover? Submit it here! Sunday, June 08, 2025 Subscribe Now News Rwanda Business Africa International Technology Agriculture Coronavirus Politics Environment Energy Infrastructure Health Crime Finance Law Housing Aviation Tourism Featured Culture Economy Education Security Women Science Religion Kwibuka Opinions Feedback from readers Editorial Sports Volleyball Cycling Football Basketball Other sports Karate Handball Cricket Swimming Tennis AFCON 2023 Entertainment Music Cinema Art Fashion Others Showbiz Videos Jobs & Tenders Epaper Events Subscribe Now Other Sports Other Sports Peace Marathon: Which elite athletes are coming to Kigali? Elite athletes from across Africa and beyond have confirmed their participation in the 20th edition of the Kigali International Peace Marathon which will take place on June 8 The marathon is Thursday, June 05, 2025 Other Sports Alice Umulinga elected first female president of Rwanda Olympic Committee In a historic milestone for Rwandan sports, Alice Umulinga has been unanimously elected as the first female president of the Rwanda National Olympic and Sports Committee (NOC Rwanda).Umulinga won Saturday, May 10, 2025 Other Sports Golf: Rwanda's Ishimwe takes shot at Guiness world record Rwandan golfer Melissa Akanigi Ishimwe is hoping to enter the Guinness world book of records by setting a new record of being the fastest unassisted golfer to complete an 18-hole in under 55 Wednesday, May 07, 2025 Other Sports Zaria Court Kigali to start operations in July Zaria Court Kigali, a new multi-purpose sports and entertainment complex owned by Toronto Raptors president Masai Ujiri, will be fully operational by July, according to the facility management. Monday, May 05, 2025 Most Read today 7 days 30 days BAL 2025: APR stun reigning champions Petro de Luanda APR BBC coach talks Nuni Omot’s addition, BAL playoffs Kigali Peace Marathon: Police announces road closures ahead of race Meddie Kagere “could join” Amavubi coaching staff Golf: Rwanda’s Nsanzuwera finishes second at international tourney in Kenya BAL 2025: APR stun reigning champions Petro de Luanda Agahozo Shalom shines at Karate GMT 2025 New trades leading headlines ahead of BAL 2025 playoffs What to know about the eight teams at BAL 2025 playoffs BAL 2025: APR stun reigning champions Petro de Luanda Algeria coach Madjid names squad for Rwanda friendlies BAL 2025: APR, holders Petro de Luanda to square off in quarterfinals Rwandan officials visit Hungarian F1 Grand Prix circuit Tennis: Rwanda’s Umulisa nominated for Sports Emmy Awards How Rwandan man is building top basketball courts all over Africa You did partners proud—​​​​​​​Kagame congratulates PSG on UCL triumph BAL set standards and we’re working hard to beat them--Minister Ngarambe Rwanda see off Zimbabwe in U20 Women’s World Cup qualifiers Other Sports 3x3 basketball expands ahead of LA 2028 Olympics Other Sports Golf: Nsanzuwera wins regional tournament Other Sports Musanze, Bugesera crowned national Sitting volleyball champions Other Sports Golf: Rwandan players set to travel to Japan to polish skills for 2028 Olympics Other Sports Lions de Fer, Resilience win rugby 7s tourney Other Sports Athletics: Sina Gerard, APR dominate podium at track and field champs Latest 4 m Why do Rwandan preachers have to get theology training? 19 m Filip Reyntjens and the killing of common sense 57 m TikTok’s Khaby Lame detained in Las Vegas for overstaying U.S. Visa 1 h BAL 2025: APR stun reigning champions Petro de Luanda 1 h Don't discard beetroot leaves, they're great, say nutritionists Peace Marathon: Which elite athletes are coming to Kigali? Thursday, June 05, 2025 Alice Umulinga elected first female president of Rwanda Olympic Committee Saturday, May 10, 2025 Golf: Rwanda's Ishimwe takes shot at Guiness world record Wednesday, May 07, 2025 Zaria Court Kigali to start operations in July Monday, May 05, 2025 3x3 basketball expands ahead of LA 2028 Olympics Tuesday, April 15, 2025 Golf: Nsanzuwera wins regional tournament Friday, April 04, 2025 Musanze, Bugesera crowned national Sitting volleyball champions Monday, March 24, 2025 Golf: Rwandan players set to travel to Japan to polish skills for 2028 Olympics Friday, March 07, 2025 Load More Do you have an idea for The New Times to cover? Submit it here! About Us Our Company Policy Terms And Conditions History Feed Subscribe Newsletter Print Jobs Advertise Online Print Jobs Tenders Classifieds Contact Us Opinions Letters to the Editors News Opinion Sports Lifestyle Video Jobs & Tenders Epaper Podcast © Copyright The New Times Rwanda 2007 - 2022",other sports the new times other sports do you have an idea for the new times to cover submit it here sunday june 08 2025 subscribe now news rwanda business africa international technology agriculture coronavirus politics environment energy infrastructure health crime finance law housing aviation tourism featured culture economy education security women science religion kwibuka opinions feedback from readers editorial sports volleyball cycling football basketball other sports karate handball cricket swimming tennis afcon 2023 entertainment music cinema art fashion others showbiz videos jobs tenders epaper events subscribe now other sports other sports peace marathon which elite athletes are coming to kigali elite athletes from across africa and beyond have confirmed their participation in the 20th edition of the kigali international peace marathon which will take place on june 8 the marathon is thursday june 05 2025 other sports alice umulinga elected first female president of rwanda olympic committee in historic milestone for rwandan sports alice umulinga has been unanimously elected as the first female president of the rwanda national olympic and sports committee noc rwanda umulinga won saturday may 10 2025 other sports golf rwandas ishimwe takes shot at guiness world record rwandan golfer melissa akanigi ishimwe is hoping to enter the guinness world book of records by setting new record of being the fastest unassisted golfer to complete an 18hole in under 55 wednesday may 07 2025 other sports zaria court kigali to start operations in july zaria court kigali new multipurpose sports and entertainment complex owned by toronto raptors president masai ujiri will be fully operational by july according to the facility management monday may 05 2025 most read today 7 days 30 days bal 2025 apr stun reigning champions petro de luanda apr bbc coach talks nuni omots addition bal playoffs kigali peace marathon police announces road closures ahead of race meddie kagere could join amavubi coaching staff golf rwandas nsanzuwera finishes second at international tourney in kenya bal 2025 apr stun reigning champions petro de luanda agahozo shalom shines at karate gmt 2025 new trades leading headlines ahead of bal 2025 playoffs what to know about the eight teams at bal 2025 playoffs bal 2025 apr stun reigning champions petro de luanda algeria coach madjid names squad for rwanda friendlies bal 2025 apr holders petro de luanda to square off in quarterfinals rwandan officials visit hungarian f1 grand prix circuit tennis rwandas umulisa nominated for sports emmy awards how rwandan man is building top basketball courts all over africa you did partners proudkagame congratulates psg on ucl triumph bal set standards and were working hard to beat themminister ngarambe rwanda see off zimbabwe in u20 womens world cup qualifiers other sports 3x3 basketball expands ahead of la 2028 olympics other sports golf nsanzuwera wins regional tournament other sports musanze bugesera crowned national sitting volleyball champions other sports golf rwandan players set to travel to japan to polish skills for 2028 olympics other sports lions de fer resilience win rugby 7s tourney other sports athletics sina gerard apr dominate podium at track and field champs latest 4 why do rwandan preachers have to get theology training 19 filip reyntjens and the killing of common sense 57 tiktoks khaby lame detained in las vegas for overstaying us visa 1 bal 2025 apr stun reigning champions petro de luanda 1 dont discard beetroot leaves theyre great say nutritionists peace marathon which elite athletes are coming to kigali thursday june 05 2025 alice umulinga elected first female president of rwanda olympic committee saturday may 10 2025 golf rwandas ishimwe takes shot at guiness world record wednesday may 07 2025 zaria court kigali to start operations in july monday may 05 2025 3x3 basketball expands ahead of la 2028 olympics tuesday april 15 2025 golf nsanzuwera wins regional tournament friday april 04 2025 musanze bugesera crowned national sitting volleyball champions monday march 24 2025 golf rwandan players set to travel to japan to polish skills for 2028 olympics friday march 07 2025 load more do you have an idea for the new times to cover submit it here about us our company policy terms and conditions history feed subscribe newsletter print jobs advertise online print jobs tenders classifieds contact us opinions letters to the editors news opinion sports lifestyle video jobs tenders epaper podcast copyright the new times rwanda 2007 2022
